{
  "description": "CORE-CONF-002 FAIL: derived field mismatch must be detected",
  "oracle_ref": "canonicalization@0.1.0#canonicalize_sha256",
  "input": {
    "b": 2,
    "a": 1
  },
  "expected_outcome": "CONFVEC.DERIVED_MISMATCH",
  "expected_canonical": "{\"b\":2,\"a\":1}",
  "expected_hash": "43258cff783fe7036d8a43033f830adfc60ec037382473548ac742b888292777",
  "notes": "expected_canonical is intentionally wrong; validator must fail-closed with CONFVEC.DERIVED_MISMATCH."
}

