{
  "description": "WORK-COMPLETE-001 FAIL: CompletionReceipt verified_source_state mismatch",
  "oracle_ref": "work-completion@0.1.0#verify_completion",
  "input": {
    "head_commit_sha": "cccccccccccccccccccccccccccccccccccccccc",
    "completion_receipt": {
      "version": "0.1.0",
      "work_item_id": "CR-2025-12-15-example",
      "to_state": "done",
      "target_ref": "refs/heads/main",
      "verified_source_state": {
        "vcs": "git",
        "commit_sha": "dddddddddddddddddddddddddddddddddddddddd",
        "ref": "refs/heads/main",
        "dirty": false
      },
      "evidence_run_id": "run-srcmismatch",
      "evidence_run_hash": "56f948e4cd0d2738ec7da43b5194a9b8bce8f7912b47f24500956f4773c940a4",
      "verified_by": "ci",
      "verified_at": "2025-12-15T00:00:00Z"
    },
    "evidence_manifest": {
      "version": "1.0.0",
      "run_id": "run-srcmismatch",
      "created_at": "2025-12-15T00:00:00Z",
      "repo_dir": "/repo",
      "policy_versions": {"skill_packs_registry": "0.1.0", "gates": "0.1.0"},
      "plan": {
        "kind": "inline",
        "inline": {
          "version": "0.1.0",
          "policy_versions": {"skill_packs_registry": "0.1.0", "gates": "0.1.0"},
          "packs": ["BP-PACK-BASELINE"],
          "pack_versions": [
            {"id": "BP-PACK-BASELINE", "version": "0.1.0", "owner": "Ben", "status": "active", "replacement": ""}
          ],
          "gate_tier": "T0",
          "gates": ["GATE-PLAN-001"],
          "pack_cap": {"cap": 5, "selected": 1, "exceeded": false}
        }
      },
      "gate_results": [
        {
          "gate_id": "GATE-PLAN-001",
          "status": "pass",
          "exit_code": 0,
          "duration_ms": 1,
          "log_paths": ["logs/001-GATE-PLAN-001.stdout.txt"]
        }
      ],
      "source_state": {
        "vcs": "git",
        "commit_sha": "cccccccccccccccccccccccccccccccccccccccc",
        "ref": "refs/heads/main",
        "dirty": false
      },
      "run_hash": "56f948e4cd0d2738ec7da43b5194a9b8bce8f7912b47f24500956f4773c940a4"
    }
  },
  "expected_outcome": "COMPLETE.SOURCE_STATE_MISMATCH",
  "notes": "Receipt and manifest refer to different commits; completion cannot be asserted."
}

