{
  "description": "WORK-COMPLETE-001 PASS: completion bound to verifiable evidence + commit==HEAD",
  "oracle_ref": "work-completion@0.1.0#verify_completion",
  "input": {
    "head_commit_sha": "aaaaaaaaaaaaaaaaaaaaaaaaaaaaaaaaaaaaaaaa",
    "completion_receipt": {
      "version": "0.1.0",
      "work_item_id": "CR-2025-12-15-example",
      "to_state": "done",
      "target_ref": "refs/heads/main",
      "verified_source_state": {
        "vcs": "git",
        "commit_sha": "aaaaaaaaaaaaaaaaaaaaaaaaaaaaaaaaaaaaaaaa",
        "ref": "refs/heads/main",
        "dirty": false
      },
      "evidence_run_id": "run-abc123",
      "evidence_run_hash": "84b2d3d5e61eab4068dd016978b6743fdfc1001a341d4f679ae2a03afa18b8ed",
      "verified_by": "ci",
      "verified_at": "2025-12-15T00:00:00Z"
    },
    "evidence_manifest": {
      "version": "1.0.0",
      "run_id": "run-abc123",
      "created_at": "2025-12-15T00:00:00Z",
      "repo_dir": "/repo",
      "policy_versions": {"skill_packs_registry": "0.1.0", "gates": "0.1.0"},
      "plan": {
        "kind": "inline",
        "inline": {
          "version": "0.1.0",
          "policy_versions": {"skill_packs_registry": "0.1.0", "gates": "0.1.0"},
          "packs": ["BP-PACK-BASELINE"],
          "pack_versions": [
            {"id": "BP-PACK-BASELINE", "version": "0.1.0", "owner": "Ben", "status": "active", "replacement": ""}
          ],
          "gate_tier": "T0",
          "gates": ["GATE-PLAN-001"],
          "pack_cap": {"cap": 5, "selected": 1, "exceeded": false}
        }
      },
      "gate_results": [
        {
          "gate_id": "GATE-PLAN-001",
          "status": "pass",
          "exit_code": 0,
          "duration_ms": 1,
          "log_paths": ["logs/001-GATE-PLAN-001.stdout.txt"]
        }
      ],
      "source_state": {
        "vcs": "git",
        "commit_sha": "aaaaaaaaaaaaaaaaaaaaaaaaaaaaaaaaaaaaaaaa",
        "ref": "refs/heads/main",
        "dirty": false
      },
      "run_hash": "84b2d3d5e61eab4068dd016978b6743fdfc1001a341d4f679ae2a03afa18b8ed"
    }
  },
  "expected_outcome": "PASS",
  "notes": "CompletionReceipt and EvidenceManifest are bound to the same source_state and run_hash, and head_commit_sha matches commit_sha."
}

