{
  "description": "WORK-COMPLETE-001 FAIL: evidence commit does not match HEAD(target_ref)",
  "oracle_ref": "work-completion@0.1.0#verify_completion",
  "input": {
    "head_commit_sha": "ffffffffffffffffffffffffffffffffffffffff",
    "completion_receipt": {
      "version": "0.1.0",
      "work_item_id": "CR-2025-12-15-example",
      "to_state": "done",
      "target_ref": "refs/heads/main",
      "verified_source_state": {
        "vcs": "git",
        "commit_sha": "eeeeeeeeeeeeeeeeeeeeeeeeeeeeeeeeeeeeeeee",
        "ref": "refs/heads/main",
        "dirty": false
      },
      "evidence_run_id": "run-not-head",
      "evidence_run_hash": "4a03561ffaa499c99c0ee23afebd4e7fc96377aeee6ee40df6bc489042ec6da6",
      "verified_by": "ci",
      "verified_at": "2025-12-15T00:00:00Z"
    },
    "evidence_manifest": {
      "version": "1.0.0",
      "run_id": "run-not-head",
      "created_at": "2025-12-15T00:00:00Z",
      "repo_dir": "/repo",
      "policy_versions": {"skill_packs_registry": "0.1.0", "gates": "0.1.0"},
      "plan": {
        "kind": "inline",
        "inline": {
          "version": "0.1.0",
          "policy_versions": {"skill_packs_registry": "0.1.0", "gates": "0.1.0"},
          "packs": ["BP-PACK-BASELINE"],
          "pack_versions": [
            {"id": "BP-PACK-BASELINE", "version": "0.1.0", "owner": "Ben", "status": "active", "replacement": ""}
          ],
          "gate_tier": "T0",
          "gates": ["GATE-PLAN-001"],
          "pack_cap": {"cap": 5, "selected": 1, "exceeded": false}
        }
      },
      "gate_results": [
        {
          "gate_id": "GATE-PLAN-001",
          "status": "pass",
          "exit_code": 0,
          "duration_ms": 1,
          "log_paths": ["logs/001-GATE-PLAN-001.stdout.txt"]
        }
      ],
      "source_state": {
        "vcs": "git",
        "commit_sha": "eeeeeeeeeeeeeeeeeeeeeeeeeeeeeeeeeeeeeeee",
        "ref": "refs/heads/main",
        "dirty": false
      },
      "run_hash": "4a03561ffaa499c99c0ee23afebd4e7fc96377aeee6ee40df6bc489042ec6da6"
    }
  },
  "expected_outcome": "COMPLETE.SOURCE_NOT_HEAD",
  "notes": "Even if evidence is internally valid, completion must be denied if it is not verifiable at HEAD(target_ref)."
}

